{
  "project": "example-load-test",
  "metric": "p95_ms_at_max_vus",
  "value": 11,
  "unit": "ms",
  "repeat": 2,
  "samples": [10, 12],
  "failures": 0,
  "summary": { "levels": 2, "repeats": 2, "max_vus": 20, "total_requests": 600, "error_rate": 0 },
  "environment": { "k6_image": "grafana/k6:2.1.0", "sample_seconds": "3" },
  "curve": [
    { "vus": 1, "requests": 200, "requests_per_second": 33.3333333333, "p95_ms": 3, "p95_samples_ms": [2, 4], "error_rate": 0 },
    { "vus": 20, "requests": 400, "requests_per_second": 66.6666666667, "p95_ms": 11, "p95_samples_ms": [10, 12], "error_rate": 0 }
  ],
  "runs": [
    { "repeat": 1, "curve": [{ "vus": 1, "requests": 100, "p95_ms": 2, "error_rate": 0 }, { "vus": 20, "requests": 200, "p95_ms": 10, "error_rate": 0 }] },
    { "repeat": 2, "curve": [{ "vus": 1, "requests": 100, "p95_ms": 4, "error_rate": 0 }, { "vus": 20, "requests": 200, "p95_ms": 12, "error_rate": 0 }] }
  ]
}
